{
  "metadata": {
    "produto": "Wolf Troubleshooting de Alertas e Falhas",
    "formato": "dados_troubleshooting",
    "schema_version": "2.0.0",
    "modelo_diagnostico": "cummins_like_decision_flow",
    "versao_base": "0.2.0",
    "data_referencia_base": "2026-05-04",
    "data_geracao_json": "2026-05-06T09:59:39",
    "arquivo_fonte": "C:\\Users\\wesley\\Documents\\13 - TroubleShooting\\01 - DB\\Base_Pai_Troubleshooting_Alertas_Falhas_MVP.xlsx",
    "chave_correlacao": "codigo",
    "observacao": "Arquivo JSON gerado a partir da planilha pai. O diagnóstico guiado usa um modelo de árvore de decisão inspirado no padrão Cummins.",
    "totais": {
      "itens_troubleshooting": 1,
      "passos_diagnostico": 10,
      "anexos": 1,
      "revisoes": 1
    },
    "avisos_validacao": [
      "Anexo órfão: ANX-0002 referencia código inexistente FST001",
      "Anexo órfão: ANX-0003 referencia código inexistente FST002",
      "Anexo órfão: ANX-0004 referencia código inexistente ASP007",
      "Anexo órfão: ANX-0005 referencia código inexistente ASP008",
      "Anexo órfão: ANX-0006 referencia código inexistente ASP009",
      "Anexo órfão: ANX-0007 referencia código inexistente ASP006",
      "Revisão órfã: referencia código inexistente FST001",
      "Revisão órfã: referencia código inexistente FST002",
      "Revisão órfã: referencia código inexistente ASP007",
      "Revisão órfã: referencia código inexistente ASP008",
      "Revisão órfã: referencia código inexistente ASP009",
      "Revisão órfã: referencia código inexistente ASP006"
    ],
    "sha256_conteudo": "0b4b84a0812b647b40d17b2b617d22e6adedb395c3029222e2fa11dc9ae689ff"
  },
  "configuracao_interface": {
    "campos_pesquisa": [
      "codigo",
      "mensagem_ihm_alerta",
      "descricao_resumida",
      "causa",
      "efeito_maquina_operacao",
      "solucao",
      "sistema",
      "subsistema",
      "origem",
      "variavel_codigo_relacionado",
      "search_text"
    ],
    "filtros_principais": [
      "tipo",
      "sistema",
      "severidade",
      "prioridade",
      "status",
      "origem"
    ],
    "ordenacao_padrao": [
      "sistema",
      "severidade",
      "codigo"
    ],
    "status_publicaveis_sugeridos": [
      "Homologado",
      "Publicado"
    ],
    "modo_operacao": "offline"
  },
  "listas": {
    "tipo": [
      "Alerta",
      "Falha",
      "Intertravamento",
      "Informação"
    ],
    "sistema": [
      "Motor",
      "Hidráulico",
      "Elétrico",
      "Compressor",
      "Coletor de pó",
      "Água",
      "Rotação",
      "Percussão",
      "Avanço",
      "Linha",
      "CAN/J1939",
      "IHM",
      "PLC",
      "Telemetria",
      "Segurança",
      "Outro"
    ],
    "severidade": [
      "Informativo",
      "Baixa",
      "Média",
      "Alta",
      "Crítica"
    ],
    "status": [
      "Rascunho",
      "Em revisão",
      "Homologado",
      "Publicado",
      "Obsoleto"
    ],
    "origem": [
      "PLC",
      "IHM",
      "ECU Motor",
      "CAN/J1939",
      "Telemetria",
      "Sensor físico",
      "Outro"
    ],
    "prioridade": [
      "P1 - Crítica",
      "P2 - Alta",
      "P3 - Média",
      "P4 - Baixa"
    ],
    "categoria_causa": [
      "Elétrica",
      "Hidráulica",
      "Mecânica",
      "Instrumentação",
      "Software/Lógica",
      "Operação",
      "Comunicação",
      "Parametrização",
      "Segurança",
      "Campo/Aplicação",
      "Outro"
    ],
    "tipo_anexo": [
      "Imagem",
      "PDF",
      "Vídeo",
      "Diagrama",
      "Print",
      "Outro"
    ]
  },
  "itens": [
    {
      "id_item": "FST003",
      "codigo": "FST003",
      "identificacao": {
        "codigo": "FST003",
        "tipo": "Falha",
        "sistema": "Compressor",
        "subsistema": "Temperatura / Sistema de arrefecimento e lubrificação",
        "origem": "Sensor físico/Compressor",
        "variavel_codigo_relacionado": "GVL_TX.FALHA_TEMP_COMPRESSOR"
      },
      "classificacao": {
        "severidade": "Crítica",
        "prioridade": "P1 - Crítica",
        "status": "Publicado"
      },
      "conteudo": {
        "mensagem_ihm_alerta": "Alta temperatura compressor",
        "descricao_resumida": "Falha gerada quando a temperatura do compressor ultrapassa o limite permitido de operação.",
        "causa": "Temperatura do compressor acima de 115 °C. A causa raiz deve ser confirmada no diagnóstico guiado: falha de arrefecimento, restrição no radiador/colmeia, ventilador/hélice sem desempenho, nível/condição de óleo inadequado, admissão restringida, filtro separador saturado, sensor/chicote com falha ou condição severa de operação.",
        "efeito_maquina_operacao": "Proteção da máquina por alta temperatura. Desligamento automático para evitar dano ao compressor.",
        "solucao": "Executar o diagnóstico guiado FST003 e corrigir a causa raiz encontrada. Não tratar esta falha como uma única ação de troca. As ações possíveis incluem limpar o radiador/colmeia, corrigir hélice/acionamento hidráulico, normalizar nível e condição do óleo, corrigir sensor/chicote, remover restrições de admissão, substituir filtro separador/filtro de retorno/óleo quando aplicável e validar a temperatura em operação.",
        "validacao_apos_solucao": "Após o reparo, limpar/resetar a falha, operar a máquina em condição controlada, monitorar a temperatura do compressor na IHM/PLC/telemetria e confirmar que a temperatura permanece abaixo do limite de disparo e que a falha não retorna.",
        "ferramentas_necessarias": "IHM, PLC/CODESYS, telemetria, termômetro infravermelho, tacômetro, multímetro, kit de ferramentas, ferramentas de limpeza e EPI.",
        "observacoes": "Conceito revisado: a aba principal contém causa provável geral, efeito e solução macro. A análise detalhada deve ficar na aba 02_Diagnostico_Guiado, em formato de árvore de decisão semelhante ao padrão Cummins."
      },
      "controle": {
        "responsavel": "Engenharia",
        "data_revisao": "2026-05-04",
        "versao": "0.2.0"
      },
      "diagnostico_guiado": [
        {
          "codigo_item": "FST003",
          "id_passo": "FST003-P0",
          "ordem": 0,
          "nivel": "Resumo",
          "titulo_passo": "Resumo da solução de problemas",
          "condicoes": "Falha ativa ou registrada na IHM/PLC/telemetria.",
          "acao": "Seguir a sequência de diagnóstico antes de substituir componentes.",
          "especificacao_pergunta": "A falha FST003 está relacionada à temperatura do compressor acima de 115 °C?",
          "se_sim_ok": "Iniciar pelo PASSO 1.",
          "se_nao_nok": "Verificar se o código/variável selecionado está correto.",
          "proximo_passo_sim": "FST003-P1",
          "proximo_passo_nao": "Revisar código da falha",
          "reparo_correcao": "Usar esta tabela como roteiro de diagnóstico. A solução final depende da causa raiz encontrada.",
          "ferramentas": "IHM / PLC / Telemetria",
          "seguranca": "Não operar a máquina continuamente com falha crítica ativa.",
          "observacoes": "Linha de resumo equivalente ao 'Resumo da Solução de Problemas' do manual Cummins."
        },
        {
          "codigo_item": "FST003",
          "id_passo": "FST003-P1",
          "ordem": 0,
          "nivel": "Passo 1",
          "titulo_passo": "Confirmar falha e condição real de temperatura",
          "condicoes": "Máquina em local seguro, operador informado, falha visível na IHM ou histórico disponível.",
          "acao": "Confirmar a falha na IHM e na variável GVL_TX.FALHA_TEMP_COMPRESSOR. Comparar a leitura/condição com medição externa quando possível.",
          "especificacao_pergunta": "A temperatura real do compressor está acima de 115 °C ou a tendência de temperatura confirma sobreaquecimento?",
          "se_sim_ok": "Prosseguir para inspeção do sistema de arrefecimento.",
          "se_nao_nok": "Investigar sensor, chicote, alimentação/sinal e leitura no PLC antes de atuar mecanicamente.",
          "proximo_passo_sim": "FST003-P2",
          "proximo_passo_nao": "FST003-P1A",
          "reparo_correcao": "Se a leitura for incoerente, corrigir sensor/chicote/entrada antes de liberar a máquina.",
          "ferramentas": "IHM, PLC/CODESYS, telemetria, termômetro infravermelho, multímetro.",
          "seguranca": "Evitar contato com partes quentes. Usar EPI.",
          "observacoes": "Este passo separa falha real de temperatura de falha elétrica/instrumentação."
        },
        {
          "codigo_item": "FST003",
          "id_passo": "FST003-P1A",
          "ordem": 0,
          "nivel": "Passo 1A",
          "titulo_passo": "Verificar sensor de temperatura e chicote",
          "condicoes": "Chave desligada para inspeção elétrica; sistema seguro.",
          "acao": "Inspecionar conector, chicote, fixação, oxidação, umidade, danos mecânicos e continuidade elétrica do sensor de temperatura do compressor.",
          "especificacao_pergunta": "Há conector solto, chicote danificado, mau contato, umidade, oxidação ou leitura elétrica incoerente?",
          "se_sim_ok": "Corrigir conexão/chicote/sensor e validar novamente.",
          "se_nao_nok": "Prosseguir para diagnóstico térmico/mecânico.",
          "proximo_passo_sim": "FST003-P6",
          "proximo_passo_nao": "FST003-P2",
          "reparo_correcao": "Reparar chicote/conector ou substituir sensor somente se confirmado defeito.",
          "ferramentas": "Multímetro, ferramentas elétricas, IHM/PLC.",
          "seguranca": "Desenergizar circuito antes de manipular conectores.",
          "observacoes": "Equivalente conceitual aos passos Cummins de inspeção de sensor, pinos e circuito."
        },
        {
          "codigo_item": "FST003",
          "id_passo": "FST003-P2",
          "ordem": 0,
          "nivel": "Passo 2",
          "titulo_passo": "Verificar ventilação e arrefecimento do compressor",